[
  {
    "ranked_list_id": "rank_task06_request_1_skill-ranker-v1_0_0",
    "request_id": "task06_request_1",
    "user_id": "cand_001",
    "model_version": "skill-ranker-v1.0.0",
    "created_at": "2026-09-18T10:59:58.583366+00:00",
    "results": [
      {
        "item_id": "job_001",
        "position": 1,
        "score": 0.15,
        "model_version": "skill-ranker-v1.0.0",
        "explanation": {
          "query_skills": [],
          "item_skills": [],
          "reason": "The item is ranked using skill overlap with the request and a deterministic tie-breaking prior."
        }
      },
      {
        "item_id": "job_001",
        "position": 2,
        "score": 0.075,
        "model_version": "skill-ranker-v1.0.0",
        "explanation": {
          "query_skills": [],
          "item_skills": [],
          "reason": "The item is ranked using skill overlap with the request and a deterministic tie-breaking prior."
        }
      },
      {
        "item_id": "job_001",
        "position": 3,
        "score": 0.05,
        "model_version": "skill-ranker-v1.0.0",
        "explanation": {
          "query_skills": [],
          "item_skills": [],
          "reason": "The item is ranked using skill overlap with the request and a deterministic tie-breaking prior."
        }
      },
      {
        "item_id": "job_001",
        "position": 4,
        "score": 0.0375,
        "model_version": "skill-ranker-v1.0.0",
        "explanation": {
          "query_skills": [],
          "item_skills": [],
          "reason": "The item is ranked using skill overlap with the request and a deterministic tie-breaking prior."
        }
      },
      {
        "item_id": "job_001",
        "position": 5,
        "score": 0.03,
        "model_version": "skill-ranker-v1.0.0",
        "explanation": {
          "query_skills": [],
          "item_skills": [],
          "reason": "The item is ranked using skill overlap with the request and a deterministic tie-breaking prior."
        }
      },
      {
        "item_id": "job_001",
        "position": 6,
        "score": 0.025,
        "model_version": "skill-ranker-v1.0.0",
        "explanation": {
          "query_skills": [],
          "item_skills": [],
          "reason": "The item is ranked using skill overlap with the request and a deterministic tie-breaking prior."
        }
      },
      {
        "item_id": "job_001",
        "position": 7,
        "score": 0.021429,
        "model_version": "skill-ranker-v1.0.0",
        "explanation": {
          "query_skills": [],
          "item_skills": [],
          "reason": "The item is ranked using skill overlap with the request and a deterministic tie-breaking prior."
        }
      },
      {
        "item_id": "job_001",
        "position": 8,
        "score": 0.01875,
        "model_version": "skill-ranker-v1.0.0",
        "explanation": {
          "query_skills": [],
          "item_skills": [],
          "reason": "The item is ranked using skill overlap with the request and a deterministic tie-breaking prior."
        }
      },
      {
        "item_id": "job_002",
        "position": 9,
        "score": 0.016667,
        "model_version": "skill-ranker-v1.0.0",
        "explanation": {
          "query_skills": [],
          "item_skills": [],
          "reason": "The item is ranked using skill overlap with the request and a deterministic tie-breaking prior."
        }
      },
      {
        "item_id": "job_002",
        "position": 10,
        "score": 0.015,
        "model_version": "skill-ranker-v1.0.0",
        "explanation": {
          "query_skills": [],
          "item_skills": [],
          "reason": "The item is ranked using skill overlap with the request and a deterministic tie-breaking prior."
        }
      },
      {
        "item_id": "job_002",
        "position": 11,
        "score": 0.013636,
        "model_version": "skill-ranker-v1.0.0",
        "explanation": {
          "query_skills": [],
          "item_skills": [],
          "reason": "The item is ranked using skill overlap with the request and a deterministic tie-breaking prior."
        }
      },
      {
        "item_id": "job_002",
        "position": 12,
        "score": 0.0125,
        "model_version": "skill-ranker-v1.0.0",
        "explanation": {
          "query_skills": [],
          "item_skills": [],
          "reason": "The item is ranked using skill overlap with the request and a deterministic tie-breaking prior."
        }
      }
    ]
  },
  {
    "ranked_list_id": "rank_task06_request_2_skill-ranker-v1_0_0",
    "request_id": "task06_request_2",
    "user_id": "cand_002",
    "model_version": "skill-ranker-v1.0.0",
    "created_at": "2026-09-18T10:59:58.583402+00:00",
    "results": [
      {
        "item_id": "job_001",
        "position": 1,
        "score": 0.15,
        "model_version": "skill-ranker-v1.0.0",
        "explanation": {
          "query_skills": [],
          "item_skills": [],
          "reason": "The item is ranked using skill overlap with the request and a deterministic tie-breaking prior."
        }
      },
      {
        "item_id": "job_001",
        "position": 2,
        "score": 0.075,
        "model_version": "skill-ranker-v1.0.0",
        "explanation": {
          "query_skills": [],
          "item_skills": [],
          "reason": "The item is ranked using skill overlap with the request and a deterministic tie-breaking prior."
        }
      },
      {
        "item_id": "job_001",
        "position": 3,
        "score": 0.05,
        "model_version": "skill-ranker-v1.0.0",
        "explanation": {
          "query_skills": [],
          "item_skills": [],
          "reason": "The item is ranked using skill overlap with the request and a deterministic tie-breaking prior."
        }
      },
      {
        "item_id": "job_001",
        "position": 4,
        "score": 0.0375,
        "model_version": "skill-ranker-v1.0.0",
        "explanation": {
          "query_skills": [],
          "item_skills": [],
          "reason": "The item is ranked using skill overlap with the request and a deterministic tie-breaking prior."
        }
      },
      {
        "item_id": "job_001",
        "position": 5,
        "score": 0.03,
        "model_version": "skill-ranker-v1.0.0",
        "explanation": {
          "query_skills": [],
          "item_skills": [],
          "reason": "The item is ranked using skill overlap with the request and a deterministic tie-breaking prior."
        }
      },
      {
        "item_id": "job_001",
        "position": 6,
        "score": 0.025,
        "model_version": "skill-ranker-v1.0.0",
        "explanation": {
          "query_skills": [],
          "item_skills": [],
          "reason": "The item is ranked using skill overlap with the request and a deterministic tie-breaking prior."
        }
      },
      {
        "item_id": "job_001",
        "position": 7,
        "score": 0.021429,
        "model_version": "skill-ranker-v1.0.0",
        "explanation": {
          "query_skills": [],
          "item_skills": [],
          "reason": "The item is ranked using skill overlap with the request and a deterministic tie-breaking prior."
        }
      },
      {
        "item_id": "job_001",
        "position": 8,
        "score": 0.01875,
        "model_version": "skill-ranker-v1.0.0",
        "explanation": {
          "query_skills": [],
          "item_skills": [],
          "reason": "The item is ranked using skill overlap with the request and a deterministic tie-breaking prior."
        }
      },
      {
        "item_id": "job_002",
        "position": 9,
        "score": 0.016667,
        "model_version": "skill-ranker-v1.0.0",
        "explanation": {
          "query_skills": [],
          "item_skills": [],
          "reason": "The item is ranked using skill overlap with the request and a deterministic tie-breaking prior."
        }
      },
      {
        "item_id": "job_002",
        "position": 10,
        "score": 0.015,
        "model_version": "skill-ranker-v1.0.0",
        "explanation": {
          "query_skills": [],
          "item_skills": [],
          "reason": "The item is ranked using skill overlap with the request and a deterministic tie-breaking prior."
        }
      },
      {
        "item_id": "job_002",
        "position": 11,
        "score": 0.013636,
        "model_version": "skill-ranker-v1.0.0",
        "explanation": {
          "query_skills": [],
          "item_skills": [],
          "reason": "The item is ranked using skill overlap with the request and a deterministic tie-breaking prior."
        }
      },
      {
        "item_id": "job_002",
        "position": 12,
        "score": 0.0125,
        "model_version": "skill-ranker-v1.0.0",
        "explanation": {
          "query_skills": [],
          "item_skills": [],
          "reason": "The item is ranked using skill overlap with the request and a deterministic tie-breaking prior."
        }
      }
    ]
  },
  {
    "ranked_list_id": "rank_task06_request_3_skill-ranker-v1_0_0",
    "request_id": "task06_request_3",
    "user_id": "cand_003",
    "model_version": "skill-ranker-v1.0.0",
    "created_at": "2026-09-18T10:59:58.583425+00:00",
    "results": [
      {
        "item_id": "job_001",
        "position": 1,
        "score": 0.15,
        "model_version": "skill-ranker-v1.0.0",
        "explanation": {
          "query_skills": [],
          "item_skills": [],
          "reason": "The item is ranked using skill overlap with the request and a deterministic tie-breaking prior."
        }
      },
      {
        "item_id": "job_001",
        "position": 2,
        "score": 0.075,
        "model_version": "skill-ranker-v1.0.0",
        "explanation": {
          "query_skills": [],
          "item_skills": [],
          "reason": "The item is ranked using skill overlap with the request and a deterministic tie-breaking prior."
        }